image_url,text,cause0,cause1,cause2,class,
"https://media.gab.com/cdn-cgi/image/width=410,quality=100/system/preview_cards/images/030/063/116/original/703cad813b1ef2e1.png","BREAKING NEWS: TURKEY MOBILIZING 45,000 RESERVE TROOPS TOWARD ARMENIA BORDER; IRAN MOBILIZING ARMY WITH HEAVY ARMOR TO SAME AREA; NATO MOVING INTO MOLDOVA","TURKEY MOBILIZING 45,000 RESERVE TROOPS TOWARD ARMENIA BORDER; IRAN MOBILIZING ARMY WITH HEAVY ARMOR TO SAME AREA; NATO MOVING INTO MOLDOVA",,,1,
"https://media.gab.com/cdn-cgi/image/width=525,quality=100,fit=scale-down/system/media_attachments/files/120/705/750/original/f90ea5826742b9aa.jpg",They want to Make us Slaves to their System: Banking Giants & New York Fed Start 12-Week Digital Dollar Pilot,Banking Giants & New York Fed Start 12-Week Digital Dollar Pilot,,,1,
https://media.gab.com/system/preview_cards/images/030/327/276/original/4192364ee6b4bbf6.jpeg,"Unfortunately, I believe he already has…",,,,0,
https://media.gab.com/system/preview_cards/images/031/806/768/original/d7dc2426bcc3d99d.jpeg,"#ElonMusk is facing a major dilemma. He said he wants #Twitter to become the most accurate source of information, but he also wants the platform to have as much #FreeSpeech as possible. He said he’s committed to free speech even if it poses a “personal safety risk” to himself.",,,,0,
"https://media.gab.com/cdn-cgi/image/width=410,quality=100/system/preview_cards/images/032/536/650/original/3c3d87dcb10e077c.jpeg",Tell those Euroweenies to go pound sand.,Tell those Euroweenies to go pound sand,,,1,
https://media.gab.com/system/preview_cards/images/020/978/505/original/eeac977dad0d70c4.png,"Satellites Would Be Attacked First, Then These Radar Stations if WW3 Commences next week","Satellites Would Be Attacked First, Then These Radar Stations if WW3 Commences next week",,,1,
"https://media.gab.com/cdn-cgi/image/width=410,quality=100/system/preview_cards/images/031/591/687/original/b67328cbc5d8df7a.jpeg","No matter the topic, Mises nearly always has an interesting point of view, worth consideration. #FreeSpeech #Mises",Mises nearly always has an interesting point of view,,,1,
"https://media.gab.com/cdn-cgi/image/width=525,quality=100,fit=scale-down/system/media_attachments/files/116/152/332/original/ba8869ff59c4fc9a.jpg",I’ve just published a post Rape Gangs and the National Shame. It’s with video link and on my site. You’ll find it in the Political Islam Category.,,,,1,
https://media.gab.com/system/preview_cards/images/024/290/345/original/f7c917497c69dc63.jpeg,"This is an original song written for and dedicated to all the people in the world who love freedom, will not wear a mask, and will not accept forced poison injections. Lyric video is coming soon.",,,,1,
"https://media.gab.com/cdn-cgi/image/width=410,quality=100/system/preview_cards/images/032/425/868/original/724f7582f84defbd.jpeg","Two weeks after the stabbing deaths of four #UniversityofIdaho students, dozens of local, state and, federal investigators are still working to determine who carried out the brutal #attack.",stabbing deaths of four #UniversityofIdaho students,,,1,
https://media.gab.com/system/preview_cards/images/009/205/484/original/de0fd68235ae2502.jpeg,"We The People Are Taking Down The Global Power Structure, The Day Of Reckoning Is Upon Us |",We The People Are Taking Down The Global Power Structure,,,1,
https://media.gab.com/system/preview_cards/images/010/479/346/original/0996b932ccbb2132.jpeg,#SuezCanal #Crisis: Here Are The Cargoes In The Crossfire,The Cargoes In The Crossfire,,,1,
"https://media.gab.com/cdn-cgi/image/width=410,quality=100/system/preview_cards/images/031/608/269/original/83b6b8a892a8ac7a.jpeg",Planned Parenthood Got Massive Loans. Why can't the facts be transparent? #Fix2020 #Truth #FreeSpeech,,,,0,
"https://media.gab.com/cdn-cgi/image/width=410,quality=100/system/preview_cards/images/032/349/915/original/584726be1ec4c992.png",#Economy -- 41 per cent of U.S.-based #smallbusiness owners report that they could not pay their #rent in full and on time in November:,,,,0,
"https://media.gab.com/cdn-cgi/image/width=410,quality=100/system/preview_cards/images/029/002/651/original/4f5d70da3997138e.jpeg","Murderapolis, er, oops, I mean, Minneapolis, again. It really has turned in to a third world shit hole. Aren’t democrat run cities great! #Minneapolis #crime",It really has turned in to a third world shit hole,,,1,
https://media.gab.com/system/preview_cards/images/032/475/784/original/d81b250bc73103bc.jpeg,#ElonMusk is trying to fix a corner of the industry #Twitterverse #freespeech,,,,0,
https://media.gab.com/system/preview_cards/images/026/354/007/original/fdfd8db8e2e81198.jpeg,"#RobbElementary School #UvaldeTexas ""The One EYE Freak Show Before Staged just like #SandyHoax",Staged #SchoolShooting,,,1,
https://media.gab.com/system/preview_cards/images/031/917/448/original/90c7fc56d604281a.jpeg,"So, like how's you're nite going? :)",,,,0,
"https://media.gab.com/cdn-cgi/image/width=410,quality=100/system/preview_cards/images/029/618/068/original/6907ac34570c65d6.png",Rare photo surfaces of top Al Qaeda leaders inside [The Islamic Republic of],,,,0,
https://media.gab.com/system/preview_cards/images/018/496/918/original/a66ec4fe7451752d.jpeg,Officials: #ShippingCompanies will pay fines if containers stay too long at ports of LA and Long Beach #California #SupplyChain #crisis,,,,0,
https://media.gab.com/system/preview_cards/images/026/354/007/original/fdfd8db8e2e81198.jpeg,"#RobbElementary School #UvaldeTexas ""The One EYE Freak Show Before Staged just like #SandyHoax",Staged #SchoolShooting,,,1,
https://media.gab.com/system/preview_cards/images/022/853/842/original/71cd7a936b305098.jpeg,"The reason for the #police #violence in #Ottawa is not what you think. It’s way, way worse:",,,,1,
"https://media.gab.com/cdn-cgi/image/width=525,quality=100,fit=scale-down/system/media_attachments/files/069/169/839/original/7faa61a0f24b72af.jpg",The Pandemic Must Be Over Because House Democrats Don’t Want Illegals Tested for COVID-19 Before Entering the Country,House Democrats Don’t Want Illegals Tested for COVID-19 Before Entering the Country,,,1,
"https://media.gab.com/cdn-cgi/image/width=410,quality=100/system/preview_cards/images/030/543/507/original/85bc992113d92849.jpeg",Total war: Russia reopens Kiev front – Thousands of troops heading for Belarus – Will seal border with Poland,Russia reopens Kiev front – Thousands of troops heading for Belarus – Will seal border with Poland,,,1,
"https://media.gab.com/cdn-cgi/image/width=410,quality=100/system/preview_cards/images/031/274/021/original/8ebeebc1e2470942.png",In Case you are having that Feeling of Being Watched.... #Fix2020 #Truth #FreeSpeech,,,,0,
https://media.gab.com/system/preview_cards/images/016/306/271/original/af8e60b1717c8b68.jpeg,* #TruthWarriors #Vaccinations injected without #ParentalConsent #Vaccinations=#Sedation & #HumanTrafficking & the jabbing #Rape of MUST BE PUT DOWN LIKE RABID DOGS!,"#TruthWarriors #Vaccinations injected without #ParentalConsent

#Vaccinations=#Sedation & #HumanTrafficking & the jabbing #Rape of #BasicHumanRights

#NeoPagan #NWO #NaZi #Nihilists MUST BE PUT DOWN LIKE RABID DOGS!",,,1,
"https://media.gab.com/cdn-cgi/image/width=410,quality=100/system/preview_cards/images/031/798/341/original/4e35c9bd36232214.jpeg",#WW3 #Russia #Nuclear “Give Kremlin A Warning”: US ‘Nuclear Apocalypse’ Submarine Enters Mediterranean Sea,Give Kremlin A Warning,,,1,
"https://media.gab.com/cdn-cgi/image/width=410,quality=100/system/preview_cards/images/029/765/590/original/611973bb7ef10554.jpeg",Endangered Afghans Continue To Run For Their Lives – A Year After [Illegitimate] Biden’s Abrupt [Surrender to Terrorists],Endangered Afghans Continue To Run For Their Lives,,,1,
"https://media.gab.com/cdn-cgi/image/width=525,quality=100,fit=scale-down/system/media_attachments/files/107/975/366/original/e2871983d0f60835.jpg","Spot on LOLOLOL, that's exactly how this behaves<USER>",#autistic #retarded #jewish #LGBT/ #LGBTQ #faggot behaves,,,1,
https://media.gab.com/system/preview_cards/images/006/244/730/original/acc50f0e34c45907.jpeg,#Hate has no place in #Trumps #America - #MAGA,,,,0,
https://media.gab.com/system/preview_cards/images/030/008/877/original/7c8828f36c4c5000.jpeg,The Week In Jihad with David Wood and Robert Spencer (Misguided Edition),,,,1,
"https://media.gab.com/cdn-cgi/image/width=525,quality=100,fit=scale-down/system/media_attachments/files/118/507/220/original/130f57df0a691960.jpg","In this episode, Larry Elder discusses Los Angeles City Councilman #KevinDeLeón refusal to #resign after #racist remarks leaked. WATCH <USER>",#racist remarks leaked,,,1,
"https://media.gab.com/cdn-cgi/image/width=410,quality=100/system/preview_cards/images/027/336/541/original/61acb1995e31de59.jpeg","#Protests, #violence put a spotlight on #Sri Lanka's collapsing economy #EconomicCollapse","#Protests, #violence put a spotlight on #Sri Lanka's collapsing economy",,,1,
"https://media.gab.com/cdn-cgi/image/width=410,quality=100/system/preview_cards/images/029/002/866/original/b9035b69ea3924de.jpeg","• 94% Of Pre-Packaged And Homemade U.S. Baby Foods Contain Toxic Heavy Metals: Study The report is accompanied by a 2-page tip sheet: #WTF Hat tip Kenny Stancil, Jane Houlihan, Charlotte Brody",,,,0,
https://media.gab.com/system/preview_cards/images/028/200/528/original/9292b9227f2b42ce.jpeg,"#Justice Howard Schultz, Starbucks CEO Who Led The Great Awokening, Forced to Close Stores Because ‘America Has Become Unsafe’",America Has Become Unsafe,,,1,
https://media.gab.com/system/preview_cards/images/024/037/056/original/a8ad542fa27817a3.jpeg,One Way or Another They Are Going To Drag us Into This War…,Drag us Into This War,,,1,
https://media.gab.com/system/preview_cards/images/022/604/903/original/8a9baf59e84b336b.jpeg,APPARENTLY PRINCE ANDREW & VIRGINIA GIUFFRE HAVE REACHED AN OUT OF COURT UNDISCLOSED SETTLEMENT!!!,,,,0,
https://media.gab.com/system/preview_cards/images/029/188/481/original/7153d6e8fd685737.png,Allah doesn't like Hindus..' Video of woman spewing poison against India,woman spewing poison against India,,,1,
"https://media.gab.com/cdn-cgi/image/width=410,quality=100/system/preview_cards/images/024/798/240/original/69a43ca6bb021d55.jpeg","This #article contains everything you need to know about the impending possibility of #WW3. Warning, what you find inside isn’t reserved for the weak minded and may shock you. Hold on to your #Petrodollar because there’s no turning back from here. #AmericanReveille",impending possibility of #WW3,,,1,
https://media.gab.com/system/preview_cards/images/030/717/911/original/9ea343c01244bde0.jpeg,"Man Attacks Catholic School Employee With Sword, Threw Molotov Cocktail At Church","Man Attacks Catholic School Employee With Sword, Threw Molotov Cocktail At Church",,,1,
https://media.gab.com/system/preview_cards/images/031/499/380/original/d1af27384aad5dfd.jpeg,Throwbacks Headlines: More #Violence Outside the #Temple-Walls: Revelation 11,More #Violence Outside the #Temple-Walls,,,1,
"https://media.gab.com/cdn-cgi/image/width=410,quality=100/system/preview_cards/images/028/690/429/original/fdf618a8fcce0e11.jpeg",He fucked around and found out. Thankfully he will survive to learn from this and hopefully be a better person. #LasVegasVapeShop #crime #karma,He fucked around and found out,,,1,
https://media.gab.com/system/preview_cards/images/011/504/650/original/0a61dac208ff34ae.jpeg,Has Socialism Really Harmed No One?,Has Socialism Really Harmed No One?,,,1,
"https://media.gab.com/cdn-cgi/image/width=410,quality=100/system/preview_cards/images/030/624/421/original/8ca315e19b3c6f9c.jpeg",#Paris #protest against Iran’s leadership following death of #MahsaAmini Thousands of people marched in Paris on Sunday to condemn #Iran's #Islamic leadership in a giant show of solidarity with the protests that erupted nationwide after,#Paris #protest against Iran’s leadership following death of #MahsaAmini,,,1,
https://media.gab.com/system/preview_cards/images/031/714/785/original/f0f028550e48992f.jpeg,"You know, I bet they wished I would just shut up....ya, #no :)",they wished I would just shut up,,,1,
"https://media.gab.com/cdn-cgi/image/width=525,quality=100,fit=scale-down/system/media_attachments/files/087/068/604/original/440fd1d4b2448feb.jpg",#Border Patrol busts #illegal #immigrant convicted of #rape as #criminal arrests skyrocket,#illegal #immigrant convicted of #rape,,,1,
"https://media.gab.com/cdn-cgi/image/width=525,quality=100,fit=scale-down/system/media_attachments/files/121/935/516/original/c09b3ee1a184367d.png",Sad to hear Bob McGrath from Sesame Street passed away today at the age of 90.,,,,0,
https://media.gab.com/system/preview_cards/images/008/688/364/original/8d823fc39976eb47.jpeg,#Socialism strips away #autonomy in the ‘futile quest’ for #equality: #Bernardi,,,,0,
https://media.gab.com/system/preview_cards/images/026/354/007/original/fdfd8db8e2e81198.jpeg,"#RobbElementary School #UvaldeTexas ""The One EYE Freak Show Before Staged just like #SandyHoax",Before Staged #SchoolShooting,,,1,
"https://media.gab.com/cdn-cgi/image/width=525,quality=100,fit=scale-down/system/media_attachments/files/101/765/431/original/1c433ab2f2bae8eb.jpg",BREAKING : Men are breaking all of those glass ceilings that women couldn't break.,Men are breaking all of those glass ceilings that women couldn't break,,,1,
https://media.gab.com/system/preview_cards/images/031/416/429/original/36a46f10f5fb830f.jpeg,"#Economy Financial Pundit Jim Cramer Cries On-Air Over Collapse Of META Stocks – ‘I Made A Mistake, I Was Wrong, I F**ked Up’","Collapse Of META Stocks – ‘I Made A Mistake, I Was Wrong, I F**ked Up’",,,1,
"https://media.gab.com/cdn-cgi/image/width=410,quality=100/system/preview_cards/images/028/540/093/original/8efa0334c2bfac87.jpeg",OMG that wasn’t really #Pelosi in #Taiwan!!! It had to be her,#drunkpelosi,,,1,
https://media.gab.com/system/preview_cards/images/026/689/935/original/64e2af1cbe4456a5.jpeg,"‘#Transgender’ #athletes have ‘intolerable’ advantage over real #women, new study affirms New Zealand researchers concluded that hormone therapy can't change the biological characteristics of men masquerading as women",‘#Transgender’ #athletes have ‘intolerable’ advantage over real #women,,,1,
https://media.gab.com/system/preview_cards/images/012/020/363/original/d2e8619f09b9df92.jpeg,"#bonehead #Biden Claims Workers Aren't Being Paid to Stay Home, Gets Confused, Then Says the Exact Opposite (VIDEO)","#bonehead #Biden Claims Workers Aren't Being Paid to Stay Home, Gets Confused, Then Says the Exact Opposite",,,1,
https://media.gab.com/system/preview_cards/images/003/585/569/original/3930c178864d1cbd.jpeg,Who is Behind “#FakeNews”? #Mainstream #Media Use #Fake Videos and Images #Psyops #MindControl Four Notorious Cases of Media Distortion,#Mainstream #Media Use #Fake Videos and Images,,,1,
https://media.gab.com/system/preview_cards/images/015/415/128/original/cde9e5293ee67dbc.jpeg,"Man Forcibly Imprisoned in Mental Asylum For Different Opinion on COVID (4 min, 41 sec)",Man Forcibly Imprisoned in Mental Asylum For Different Opinion on COVID,,,1,
https://media.gab.com/system/preview_cards/images/013/410/906/original/f72f35cc0afcb440.jpeg,#WTF Politician wants to alter the moon’s orbit to fight Climate Change:,Politician wants to alter the moon’s orbit to fight Climate Change,,,1,
"https://media.gab.com/cdn-cgi/image/width=525,quality=100,fit=scale-down/system/media_attachments/files/101/129/179/original/02803f8b07bccb43.jpg","Q+Anon+Plus, [3/9/2022 3:36 PM] [ Photo ] This is Waddesdon Manor. The largest Rothschilds Home in Europe. It has now joined the political arena in support of you guessed it = The serpent slithers it tongue in the dark corner. Support the other side, against Rothschilds",The serpent slithers it tongue in the dark corner.,,,1,
https://media.gab.com/system/preview_cards/images/030/522/892/original/fb01ce20a87163c7.jpeg,Overdose? The #GOP done overdosed on #Equality #Diversity and #MLK ... they are all fucked up thinking they are the MOTHER OF THE BLACK RACE ... GOOD LORD! (190) Overdose - YouTube,they are the MOTHER OF THE BLACK RACE,,,1,
"https://media.gab.com/cdn-cgi/image/width=410,quality=100/system/preview_cards/images/030/229/185/original/f1d36d9b11c0d598.jpeg",NYC man sentenced to 30 years for stabbing cop in neck during George Floyd protests,stabbing cop in neck,,,1,
"https://media.gab.com/cdn-cgi/image/width=525,quality=100,fit=scale-down/system/media_attachments/files/121/937/140/original/4d35b17b15108560.jpg",Ah! It's the end of the world! It's supposed to be nighttime but I can see perfectly. We're doomed! Doomed I say!,It's supposed to be nighttime but I can see perfectly,,,1,
"https://media.gab.com/cdn-cgi/image/width=525,quality=100,fit=scale-down/system/media_attachments/files/079/937/642/original/f4f3f0753bea12e8.png",Keys to Preventing #Abuse as Explained by #Vatican Expert Fr. Hans Zollner in an Exclusive Interview VIDEO,,,,0,
https://media.gab.com/system/media_attachments/files/056/435/354/small/61d281fff8d5be62.png,"“We don’t want Muslim barbarians in AMERICA.” “We will not become like France and the UK where beautiful cities are being destroyed by Muslim #crime, #rape, #garbage in the streets, and #rampantwelfare dependency.”",Muslim barbarians in AMERICA,"beautiful cities are being destroyed by
Muslim",,1,
https://media.gab.com/system/preview_cards/images/013/582/294/original/9810a30cef26c896.jpeg,[VIDEO] Kennedy Blames #Biden's #Border #Policy Changes For Current,#Biden's #Border #Policy Changes For Current #Crisis,,,1,
https://media.gab.com/system/preview_cards/images/028/939/199/original/8f7210e0bf400315.jpeg,"In #WTF news. Clotshot Creature Removed From Beating Heart Caught On Video!! ""Holy hell!! This is our government inflicting this shit on our bodies. Don't let them inject anything in your body."" --<USER> 8.13.2022",government inflicting this shit on our bodies,,,1,
https://media.gab.com/system/preview_cards/images/001/113/734/original/397471d48d1a28eb.jpeg,"United States Population (LIVE) 333,150,940 (in the time it took me to post it the # went to 333,150,955.....#WTF) Who The Fuck Voted For This Idiot???","United States Population (LIVE)
333,150,940
(in the time it took me to post it the # went to 333,150,955",,,1,
"https://media.gab.com/cdn-cgi/image/width=525,quality=100,fit=scale-down/system/media_attachments/files/117/375/752/original/691bcc963ef3ceb4.jpg",This is the guy calling you a fascist.,This is the guy calling you a fascist,,,1,
https://media.gab.com/system/preview_cards/images/031/831/281/original/ae91aafd81fb390a.jpeg,"BLOOD MOON BLOODBATH... Democrats Steal #Midterms, #Communism Comes Home to #America... #Crime, #Inflation, Record #GasPrices, #War, #OpenBorders and #Corruption WIN BIG","BLOOD MOON BLOODBATH... Democrats Steal #Midterms, #Communism Comes Home to #America... #Crime, #Inflation, Record #GasPrices, #War, #OpenBorders and #Corruption WIN BIG",,,1,
"https://media.gab.com/cdn-cgi/image/width=410,quality=100/system/preview_cards/images/028/300/900/original/4ef878f992d199f3.jpeg",#WW3 Taiwan holds air raid drills as China doubles down against Nancy Pelosi visit,Taiwan holds air raid drills,,,1,
"https://media.gab.com/cdn-cgi/image/width=525,quality=100,fit=scale-down/system/media_attachments/files/105/610/973/original/ce955669daa30d00.jpeg","What will the next crisis be? Will we be ready? Visit to give feedback, ideas, and tips.",,,,0,
"https://media.gab.com/cdn-cgi/image/width=410,quality=100/system/preview_cards/images/029/092/209/original/7059d5a244b10b95.jpeg","Status of Global War against #Terrorism [This IS a ""forever war"" for as long as islam exists. Accept that fact]","""forever war"" for as long as islam exists",,,1,
https://media.gab.com/system/preview_cards/images/032/068/867/original/09aee3259c8c1c61.jpeg,I was gonna say something nice and then #Wednesday happened :/,#Wednesday happened :/,,,1,
https://media.gab.com/system/preview_cards/images/021/546/844/original/718e10bde9d6a440.jpeg,Democrats impose their unconstitutional #abuse of their #Political #Prisoners as the sheep are turning into rams.,Democrats impose their unconstitutional #abuse of their #Political #Prisoners as the sheep are turning into rams.,,,1,
"https://media.gab.com/cdn-cgi/image/width=525,quality=100,fit=scale-down/system/media_attachments/files/119/421/841/original/33fc4a20218b3d90.jpg",So why would Fox News 10 phoenix already be declaring Katie Hobbs the winner in the governor’s election for AZ?,,,,0,
https://media.gab.com/system/preview_cards/images/020/217/728/original/d6927dac49fbaf8c.jpeg,"Conspiracy Of Silence (Banned Discovery Channel Documentary) Until you realize that ALL #Government is #Evil you'll NEVER WAKE UP! Left vs Right my a**! They ALL WORK TOGETHER to keep you in bondage, a #Slave, a Strawman for their Corporation to ABUSE!",ALL #Government is #Evil,,,1,
"https://media.gab.com/cdn-cgi/image/width=410,quality=100/system/preview_cards/images/023/644/124/original/8c5f89f3e213acd3.jpeg","""Proposed law in Maryland would allow mothers to kill their babies up to 28 days AFTER birth""",allow mothers to kill their babies up to 28 days AFTER birth,,,1,
https://media.gab.com/system/preview_cards/images/007/915/517/original/d1141a009edd9672.jpeg,Fight now or be a #slave #america #CCP,Fight now or be a #slave,,,1,
https://media.gab.com/system/preview_cards/images/007/244/744/original/71dec0d39bff3cd3.jpeg,"""Bill Shorten knew I was 16, he handed out the spliffs & alcohol and he raped me.""",he handed out the spliffs & alcohol and he raped me,,,1,
https://media.gab.com/system/preview_cards/images/032/067/370/original/60f2e56e60f54d92.jpeg,Officials provide details on 22 LASD sheriff's recruits injured after being struck in Whittier crash #California #Crime #Terrorism,22 LASD sheriff's recruits injured after being struck in Whittier crash,,,1,
"https://media.gab.com/cdn-cgi/image/width=410,quality=100/system/preview_cards/images/031/664/394/original/4bd40dc78c460073.jpeg",These leftists #fakenews anchors are getting dropped like a sack of potatoes!!!... Another one bites the dust!!!,These leftists #fakenews anchors are getting dropped like a sack of potatoes,,,1,
https://media.gab.com/system/preview_cards/images/027/651/348/original/f2bcd1f3a08317aa.jpeg,Islamist Terrorism Resurfaces in Scandinavia,Islamist Terrorism Resurfaces in Scandinavia,,,1,
"https://media.gab.com/cdn-cgi/image/width=410,quality=100/system/preview_cards/images/025/742/128/original/29384dec740dc1f5.jpeg",This moronic administration is about to start WW3!,This moronic administration is about to start WW3,,,1,
https://media.gab.com/system/preview_cards/images/032/202/258/original/6b242c655e5581a0.jpeg,"Club Q: Witness Describes Mass Shooting Inside The Colorado Springs LGBTQ+ Club: ""We are a broken community."" #Colorado #Crime #Terrorism","Mass Shooting Inside The Colorado Springs LGBTQ+ Club: ""We are a broken community.""",,,1,
https://media.gab.com/system/preview_cards/images/031/999/061/original/423a4886acfd918e.jpeg,"I hate you, you hate me, we all hate hu-mannnn-ity",we all hate hu-mannnn-ity,,,1,
"https://media.gab.com/cdn-cgi/image/width=410,quality=100/system/preview_cards/images/030/990/598/original/81a351dce4bad71d.jpeg","A financier warns, you can still save your savings",,,,0,
https://media.gab.com/system/preview_cards/images/029/421/161/original/f7bd5e3470eb728b.jpeg,Best explanation of #Illegal #FBI #MaraLargo raid & President Trump's legal recourse!,,,,1,
https://media.gab.com/system/preview_cards/images/025/275/929/original/02bed3769076bcfe.jpeg,EMOTIONAL/SOUL PAIN NEW AGE and SHORT TERM EFFECTS ADDICTIONS Website:,,,,0,
https://media.gab.com/system/preview_cards/images/030/469/243/original/fb96f78eab9261d2.jpeg,"Throwbacks Headlines: And then look at all the American deaths at the hands of #illegal-aliens, both Mexican illegals and Other Than Mexican, such as Kate Steinle, who was #murdered on a pier in San Francisco as she stood next to her father in conversation in 2015.",American deaths at the hands of #illegal-aliens,"Kate Steinle, who was #murdered on a pier in San Francisco",,1,
"https://media.gab.com/cdn-cgi/image/width=410,quality=100/system/preview_cards/images/031/212/168/original/575bd6d681dde507.jpeg",Diesel Supply of Just 25 Days Poses Problem for Biden #Economy,,,,0,
https://media.gab.com/system/preview_cards/images/013/280/824/original/1af01ed06725a8c5.jpeg,"#Bureaucrats, #politicians, and #corporations, especially the #airlines, are drunk on #abuse and #power because we let them get away with this #nonsense. Stop participating, #TakeTheMaskOFF, and go get a #CranialRectalExtraction ASAP!!!","#Bureaucrats, #politicians, and #corporations, especially the #airlines, are drunk on #abuse and #power",,,1,
https://media.gab.com/system/preview_cards/images/032/296/301/original/183a9b0c9cc4f5ac.jpeg,"So, let's light up #Thursday...cuz, #whynot :)",,,,0,
https://media.gab.com/system/preview_cards/images/031/214/095/original/48ff5a8608d2226f.jpeg,"Steve #Bannon To Be Sentenced Friday, Faces Six Months in Jail",,,,0,
"https://media.gab.com/cdn-cgi/image/width=525,quality=100,fit=scale-down/system/media_attachments/files/023/579/705/original/90700e38357918a7.jpeg",#PANIC #KAG2020 #HouseOfCards [THEY] never thought she would lose,,,,1,
https://media.gab.com/system/preview_cards/images/022/316/835/original/41bf28323aa51660.jpeg,"This is the type of animal that walks freely in our streets, Woman Blindsided by a Bat to the Back of her Skull. VIDEO",Woman Blindsided by a Bat to the Back of her Skull,,,1,
https://media.gab.com/system/preview_cards/images/031/572/137/original/037562b1211e745c.jpeg,The Deleted #History of Islam: Interview with Raymond Ibrahim,,,,0,
